Index,Name,EAN
1,Organization to two together.,4836810209885
2,Represent recent lot.,2668829157992
3,Wall important event bank.,6371019679643
4,Tax ball candidate wonder.,7887131090512
5,Message relate Mrs.,7035615446199
6,Agency likely happen start.,0107610691403
7,Heart policy discuss each.,5813368043474
8,Minute interesting air big.,4999734182440
9,Allow every try more.,7096797032181
10,One but face beyond before.,6324442001130
11,Tv full same type seek.,6586222245749
12,Contain others buy.,5261286562728
13,Miss bed age onto Mrs up.,7888350902181
14,Dream teacher lead company.,9513738813695
15,Idea no really idea form.,6552831457989
16,Assume source decision set.,9385265322281
17,Eight source without kitchen.,0393442949366
18,Person minute we cut police.,7866399535003
19,Professional find have nor.,3392101317475
20,Seek hit accept blue.,9483121099251
21,From among region.,4306766748146
22,Month score how send with.,5195971450987
23,Support artist themselves.,9027834433560
24,Home family hear what.,4374164807840
25,Gun lead shoulder prepare.,3923352976922
26,Occur think player cup.,2499542658448
27,National sport chance hear.,6687658548012
28,Finish this cold citizen.,3369586461443
29,Wear act glass stay decade.,0010348179993
30,Month school such.,8008987643601
31,Of I perhaps remain.,4169514080284
32,Process happen law accept.,1821890936465
33,Quite alone military book.,1735806256786
34,My would kid.,1981829841656
35,Firm here avoid film.,7993139088571
36,Front heavy west.,9503474841632
37,Degree meet without let.,7729546337502
38,Customer let impact draw.,0528623153410
39,Too friend have often.,5446156002690
40,Here close a citizen.,6086058961542
41,From how identify modern.,3572897097212
42,Anyone on may project.,0726082325762
43,Imagine pressure face good.,3034722061824
44,Machine thousand lose window.,4700776260450
45,Risk police much.,6151684265453
46,Community country time along.,5398717376859
47,My five moment national.,5107919285889
48,Age thus work statement.,3470887404647
49,Road will especially term.,6293510033109
50,Help whose democratic.,6557141765298
51,Special forward up case.,6597758341881
52,Seven capital pull dog.,9163116888458
53,Few exactly others question.,5614501699875
54,Image give quickly.,1571665726196
55,Role follow though remember.,6665455694743
56,Director view region expect.,6008348064801
57,Six million thank fund.,0645982758572
58,Alone school call indeed.,0477646038122
59,Human summer analysis modern.,6615782696927
60,How care group land large.,5740752328568
61,Into watch hand four white.,8833699781972
62,Beat allow system so popular.,0419754895419
63,Experience guy watch job.,4111443888721
64,Second try matter white now.,9019074476902
65,Building tough financial.,8049767294040
66,Score give stop quickly.,5911839041384
67,Every trade crime.,1248215352272
68,Because include poor hundred.,7076382576849
69,Also direction training have.,8826432942655
70,Force from story north.,5973387616957
71,Investment might act.,2421439966114
72,Those red produce simple.,1498131146879
73,Feel heavy smile television.,8503767400004
74,Much board gun.,9634288514327
75,Ability particularly other.,5517790126964
76,Owner per group him become.,6010501948439
77,Discuss vote we car myself.,0867504935913
78,Night medical agree wall.,9137584784895
79,Rest student everybody big.,8840090664629
80,Bad guy bit responsibility.,6945270488582
81,To idea firm task interview.,0979366380999
82,Office watch dog still dog.,8300382722760
83,Down former wait by its.,7485971073704
84,It whose way hair check she.,7578273189492
85,Find game require understand.,8695055621540
86,Sure American east another.,6801867947996
87,Seek book short name but.,3684119690375
88,Those thank half sort.,4298365384163
89,Believe return too law.,7155665456488
90,Unit nation middle I close.,2612175899686
91,Onto age politics.,9323231552188
92,Lay drive small cost cost.,7423030522367
93,Second season natural under.,9986672178586
94,Report inside why life drug.,2161051681513
95,Left move draw.,0470397590949
96,Wind staff agree security.,4085774402843
97,Dream kind area.,6219275064929
98,Mind so there heavy.,3496138394260
99,Republican tend town by.,1094691100094
100,Challenge page bed.,4931842900950
101,Also behind choice area.,3119308275816
102,Discover day add.,2359184765716
103,To house hotel above local.,8209543908169
104,Employee risk rock.,7554624349661
105,Stay stop stand into.,7792583683185
106,Election low account away.,0704222186855
107,Mrs plant prevent time worry.,7259171158727
108,Behavior person second gas.,8138037066781
109,Leg dinner it knowledge.,9474724214431
110,Popular buy citizen.,5580256621532
111,Today modern address back.,1657334794250
112,Dark meeting mother choose.,5467554460424
113,Cup lawyer myself event put.,6729599087073
114,Church film project see.,2577120388212
115,Campaign sport set.,5692266376361
116,Commercial letter dog.,4399872510097
117,Line anyone maybe pay rather.,7050342488953
118,Summer film listen.,9822035831371
119,Modern parent point seven.,3007914610858
120,Realize many who writer.,5895022827163
121,Hear physical different.,0504392018297
122,Manage despite within.,0211244478290
123,Agreement bed collection.,9553714228525
124,Top accept guy book.,3818939415447
125,Condition answer edge maybe.,0773281502807
126,Mean modern camera.,1510639208757
127,Subject town here.,2122358703087
128,Feel far certainly boy.,0362749732575
129,Control would arrive ago.,2708937358635
130,Include thousand one chance.,1660218051486
131,Ball world position among.,9176569868878
132,Cost particular occur across.,2846852925980
133,Join make tax develop.,8905343276193
134,Upon goal himself any.,8190435069450
135,Task these wrong.,3922785200123
136,Health peace building true.,7492928846212
137,Page nation teacher personal.,5952367342321
138,Share against war.,7734105071322
139,This action none force.,6894356483556
140,Form road seat fight.,4381855897400
141,Expect study fish bring.,4805178632826
142,Seek why some without.,8235922829244
143,My experience tell.,7558726339582
144,Watch officer tree avoid.,5416824869115
145,List world week move year.,5149297851782
146,Voice figure either ask.,6143064143871
147,Summer baby future.,3060320408037
148,Property six able.,9058690470420
149,Three low parent buy per yet.,6758768415225
150,Kitchen style develop so.,9818969935452
151,Usually college week.,3163792633966
152,Run place chair moment seek.,5867563809281
153,Positive real week weight.,7910974155008
154,Story ten gun.,9133204963510
155,Himself produce event effort.,7503162547466
156,Describe increase ever arm.,8626408174482
157,Guess building fight up team.,9474842487595
158,Attack dream into.,5238813182001
159,Day month back course room.,9107547373015
160,Show event city chance none.,8467984433521
161,Election over color choice.,6721316765080
162,Buy follow road skill Mr.,8632166051224
163,Minute old always ask.,8000500306239
164,Throw six nothing method.,7614296522394
165,Chair natural author mission.,5128425086845
166,Goal off recent.,9086908733203
167,Take western pretty expert.,6769301324065
168,Power leader first too.,1518393825463
169,Ask so resource.,6754074045576
170,Six which door turn loss.,6693635464312
171,Far culture real.,6949184337431
172,Rich theory any could.,5909248203202
173,Should new force future.,6813352795630
174,Him peace material.,5825321424022
175,Resource pattern peace focus.,9108884990033
176,Street music national man.,2326786129666
177,Oil hand type over meet.,8571444362037
178,May feel property those.,3870663330212
179,Field story foot.,7842097406593
180,Allow hair nothing doctor.,8686786877429
181,Within write gas trouble.,4815369625872
182,Set by hotel laugh station.,8641515224608
183,People wonder some beautiful.,7188450628418
184,Allow talk court.,8417666316758
185,Which safe PM win have east.,5004084360291
186,People dream wife tell class.,3861579549980
187,Listen thought analysis put.,1458419005649
188,Finish well sit culture.,1047504813605
189,Him beat certain eye bad.,9402346687135
190,Page weight share half.,9212394051952
191,Case option too so machine.,5205670224649
192,Miss size institution big.,0852536671984
193,Wife job professor maintain.,9831637669657
194,Grow seven business leg.,6733696016881
195,Risk upon imagine skin.,2335257597651
196,Become drive course although.,9201114140076
197,Can prove consumer along.,1904601689284
198,Son subject resource.,1315653892681
199,Enter Congress stand.,2049684816635
200,Travel wait across war.,6309455136390
201,Friend record that yet.,0983019910716
202,Third arrive throughout hour.,0992588558205
203,Into civil PM cover bank not.,3251191172220
204,Then under can.,1965105905102
205,Have memory imagine Mrs.,9711842810719
206,Decision vote part.,7981720383914
207,Positive learn who remain.,8666991946745
208,General occur determine.,1571108314461
209,Enjoy anyone skill news.,0517737783842
210,Age mouth but indicate away.,8158953005107
211,Most act reality fact sea.,7610174650807
212,Professor first here major.,0158055067889
213,Family read wish small.,9294369851187
214,Not hold candidate up.,5193241427868
215,Bit again he.,0405382640675
216,Which name color stock.,1147843478807
217,Stay fight when very visit.,1523021056751
218,Difficult bank job.,9407472613447
219,Herself son end democratic.,0905257303358
220,Best season my question past.,5640212147343
221,Type cost seek art.,0338648310527
222,Back employee none total.,5612864049238
223,Body teacher money fire keep.,6462767526027
224,Article who unit fine bad.,9256972268851
225,Later final mention.,3180827960613
226,Up friend east receive.,2132747047456
227,Hear opportunity note that.,2299494303355
228,Home none challenge let.,2892978030763
229,Factor save car.,1423095100551
230,Wife product fish series.,9937390630696
231,Wife model exist up.,1383903243392
232,Wrong visit spend detail.,7099409327248
233,Address book argue.,6580928404295
234,Different report red still.,8358581511647
235,Film argue data team.,6119941703025
236,By design land new.,6369400691923
237,Common teach student street.,9498684673626
238,Work issue local once child.,4751492913175
239,Stuff it significant.,3451768512439
240,Majority sound many town.,4756840586438
241,Else really matter around.,1983642883998
242,Your room wish lose.,0450113765158
243,Industry himself where.,6907221174395
244,Attention bed pass two draw.,9320595501630
245,Agree doctor ever.,2189784362486
246,During turn week.,5362690545199
247,World door whose.,3936058072508
248,Fear let six alone.,0685314782448
249,Beyond impact person.,6764729803369
250,City type forget should.,3586141427977
251,Material rule present action.,2657810440731
252,One should trade.,9129854379535
253,Chair off song else issue.,9001098341502
254,Soon leader say everything.,3835492374776
255,Less fly free form make.,8650667010410
256,Both during save push.,7009458229639
257,Lose since rate interview.,6978817280530
258,South audience than big.,4123270985238
259,Hotel word keep make.,6681498491958
260,Speech economic number class.,0725203429709
261,Century phone mean.,6725959283635
262,Daughter common site mouth.,7085424039228
263,Win yet can investment.,0407436174945
264,Least push we important.,4475803886537
265,Safe best attention involve.,9566362717068
266,Range start water.,3039950301483
267,Seem final by.,3917343768016
268,Popular rule leg stop.,6193376811463
269,Future worry ready certain.,9704436197235
270,Field the out trouble.,1993235347721
271,Produce force world.,2998068664624
272,Ground important opportunity.,8897294430727
273,Old real author.,9082120158626
274,Pay type crime.,0037199103397
275,Discuss car shake reveal.,3141568755432
276,Medical traditional new dog.,9551279185406
277,Stuff member why everybody.,0724636764999
278,Author large information.,1186695571861
279,Call card reality theory.,2328470996653
280,Over fire appear none.,6021365803178
281,Art own program thought add.,2099900539039
282,Mean red which.,5436477262842
283,Same research phone data.,7857731763963
284,Expert more I senior focus.,2469343218103
285,Plan him away them.,0764783467756
286,Result radio ready.,0108665060985
287,Term music forget probably.,3751851252816
288,Hard trade next finally.,2156233193410
289,Month movement between fill.,1597644469168
290,Tree scientist report later.,7448296391212
291,Should cup any trouble.,8770751468702
292,Exactly price no.,8211473443054
293,Compare member prevent arm.,1106068183736
294,Kind three cut.,0406580284029
295,Plan hope oil. At pay town.,6506624293377
296,Part someone wear sound.,9251526488983
297,Travel suggest term unit.,5036999894936
298,So difficult plan ask who.,8588593919043
299,Maybe draw foreign of rich.,0370180334289
300,They four field floor power.,2646156313557
301,Page control foot state face.,9751294720860
302,Federal three toward black.,1028566379643
303,No age less president.,2948501941485
304,Decade chance figure some.,0183791725540
305,Old major rule note down.,9372933678351
306,Price high wear watch hot.,9890646290986
307,Call spend hotel.,4059773113192
308,Movement street less catch.,1125013811111
309,Leave night security heart.,6980824302907
310,Pretty card five bar for.,5558334067145
311,Modern about baby look.,7454345805647
312,Something floor charge talk.,1941178392179
313,Dark day color fund she.,0713596302235
314,Manager fear health.,3385119497529
315,Worry design near seat.,3601509325181
316,Why indicate upon decade.,8396939455168
317,Evening week memory through.,1170024432374
318,College human stage team.,7138409406338
319,After analysis lose why.,5190862240210
320,He hard near require.,7043080400035
321,Various star receive energy.,9466174579840
322,Know business fact police we.,1406422221365
323,History good inside teacher.,8960245398091
324,Occur son power.,5481782125801
325,Treatment moment minute.,2449948460695
326,Be range religious.,2758412758030
327,Nothing perhaps trade term.,6169750929420
328,Fund in few drug.,7038851844057
329,Five it involve almost stage.,8580337830027
330,Yes activity take.,1412646805663
331,Work quality respond.,1627127405151
332,North find pull war care act.,4503662624813
333,War successful stop.,5876613524340
334,Describe question live add.,9565851826632
335,Town red bad.,2023293849000
336,Race which new here.,3017107569986
337,Fire ago fine him.,2466449614556
338,Amount boy along.,8320708524304
339,Big lot control tell.,9061767354349
340,Church scene travel board.,6283131760362
341,Since require turn.,7678679593777
342,None ago since sit.,0721426967257
343,Put structure hope really.,9259874247856
344,Baby require she hotel.,5079268811418
345,Sister stage remember.,0864665097191
346,Special century eye.,3300139348453
347,Get deep help.,9361672043971
348,Memory agency know.,2982166241184
349,Discuss myself own white.,5471432134987
350,Admit student them item.,1299999013200
351,When couple compare seek.,0747760601701
352,Example half but middle blue.,3597825209123
353,Hour attorney music.,1031053413676
354,Artist hard understand.,3381273265264
355,Four since Mrs suggest.,0206247702237
356,Capital generation per end.,5922864562300
357,Soon tend pass share.,3715354137827
358,Front prevent outside off.,4419012426160
359,Term team appear easy air.,7479963570739
360,Body heart inside read.,5193720062948
361,East their chance five fact.,8660140021956
362,Either science scene article.,7434207129500
363,Decision heavy hair door.,2617832357332
364,Play the someone.,3130385625998
365,Spring rate general group.,7518811187832
366,Common standard its dark own.,2535151990439
367,Own arm media as now.,0970043656079
368,Kind hear impact chance.,9922351135716
369,Then win hold key.,9753212126976
370,Night anything peace four.,1927026581957
371,While create it.,2921693816748
372,More four wait job.,7885213882185
373,Free program skin drop.,7132519284367
374,Course perhaps forget.,3053009884130
375,Save political we benefit.,3781588340357
376,Out site general reach here.,2599728683681
377,Fast probably money series.,4066192448583
378,Something knowledge imagine.,9234412414624
379,Former yard case.,0841711305349
380,Skill buy those.,2047458872481
381,Him whose represent while.,5305623727149
382,Walk wonder message most.,4889973390396
383,Some final area moment about.,0279609289639
384,Actually technology own edge.,6132663277186
385,Identify start factor admit.,5020285428110
386,Throw me commercial.,4099765974486
387,Them about pattern.,7084844868029
388,Truth street after.,7577247342567
389,Box add fill exist attack.,6111172865435
390,Radio rate form social.,6716386784628
391,Itself PM security professor.,7349867884150
392,Establish mind store adult.,7181562540623
393,Difference girl day remember.,5653443601850
394,Traditional owner put leg.,8887234315313
395,Mention subject deep.,1699947600368
396,Little late say onto.,5563713490513
397,Key write notice sort.,6895199788167
398,Nature marriage common.,7198768220266
399,Magazine community money.,7462976512384
400,Science issue tend nice.,3395021835463
401,Generation maybe reflect.,0096110279672
402,Example together very.,0426128959349
403,The even impact.,6926375596679
404,Rate again view price.,8893515798331
405,Local evening remain watch.,8346144938383
406,Six head ahead mission.,8109883981979
407,Any under nor information.,9781945735929
408,Leave design bank vote book.,4773572760196
409,Standard task her.,5220965061754
410,Itself suddenly arm.,8668857603052
411,Type kid still design.,1384654864737
412,Local movement lead rather.,4987380259654
413,Easy or carry report cell.,6254195425870
414,Pick throw image actually.,5671390250594
415,Little cup actually.,6940482772177
416,Dog model now seven seat.,8455616856725
417,Board area dog.,9817981564978
418,Nice computer read ever.,2685930612196
419,Or do involve walk suggest.,9239823009193
420,Else result them point.,9143622727359
421,Receive fire measure benefit.,6361380601671
422,Ahead people from visit.,4909593505519
423,Change soon bed fill.,1939390503749
424,Per leg scene policy.,1137670130719
425,Clearly run strong safe.,5392079699410
426,Care author light wife.,3031446885903
427,Occur cold south member.,9526327866972
428,Star we act bit Mrs.,6000059474054
429,Inside close product parent.,0064652640472
430,Education season Mrs build.,0689044014091
431,Into story sort phone.,0787179629446
432,As energy arrive chair.,0456631281064
433,Than police check hospital.,5097616459631
434,Send group action.,7028277018699
435,Away fight book prove.,2484979373163
436,Agree effort share war sure.,2248362503656
437,Perhaps benefit red look.,6414138856448
438,For resource class reduce.,9024293568161
439,Body who black buy us.,3338044306671
440,Learn natural contain region.,8925093061917
441,Across operation ask say.,3851599936044
442,Reflect answer majority.,3074309898535
443,Drop how land test season.,1572349860878
444,Do gun consumer save.,8060493347190
445,Floor strong successful fish.,2274893164561
446,Do garden computer movement.,4854304080000
447,Billion such medical cause.,4329564534964
448,Spend stuff yeah fund rate.,2090411327993
449,Say sit hit across.,2292802711620
450,New foot art machine edge.,9712704915672
451,Yes heart smile bag.,9637404875999
452,Ability radio look bad large.,3797430646997
453,Heavy career create.,9846877357417
454,Interest reduce model value.,2950388731509
455,Effort stage a represent.,2684846900267
456,Specific might good poor.,5549993268202
457,Before get job.,3009513418903
458,Stand wait always agent.,0471448202033
459,Call better type leave.,4841678514644
460,Base attention action huge.,1630626154567
461,Plant assume car air.,1545843690890
462,History yet pay into.,3718670916374
463,No where quite speech.,2304530211584
464,Win manage oil try.,6691363566759
465,Task yes total themselves.,0203170213403
466,Leave agent assume.,6956547271226
467,Win share admit.,4677030288294
468,For participant only.,0656879973848
469,Gun likely high.,7209903958866
470,Wear entire three official.,1474185724317
471,Near answer example article.,6503026752945
472,Civil single whom.,7998893752928
473,Purpose section dark present.,7568685609077
474,Give box respond receive.,6328481084604
475,Couple book trip.,0265179992857
476,Think second oil side.,8967122004939
477,Role hit experience.,0457930983512
478,Decide town theory.,9827324754546
479,Record we same material.,4744328655240
480,Stop ago positive white six.,9061115403682
481,With mouth big black.,5925198285860
482,A attention line Mr.,3778487740326
483,Area have seat hand phone.,9844785865413
484,Never key sound couple lay.,7003989800671
485,Husband short black bad.,8480432492574
486,Community attention under.,4429510130049
487,Carry feeling poor other.,7164975296165
488,Inside open late class.,2821738543229
489,Different drug prove I truth.,5131836335204
490,Fund boy fear water.,1090192918381
491,Late we hear sea discover.,6519416748252
492,Talk serve their study.,6023694163459
493,Adult prepare author herself.,3834859943082
494,Water operation own.,0616727180453
495,If not senior.,4275542585162
496,Account yet which reflect.,6908102638906
497,Real too structure ok deep.,1898439676083
498,Special talk local.,2851499603573
499,Cost watch ever contain by.,0476371771458
500,Study continue back chance.,1957358185905
501,Wonder claim decide space.,0483348720654
502,Walk include test throughout.,2017131718153
503,Road part machine money.,3966444780762
504,Police eye for baby.,1009857615626
505,Walk public really hospital.,7217173630115
506,Catch lead create able.,7178390747591
507,Attack enter would cost.,4122465665641
508,Team physical state.,3890061998630
509,Put us pressure.,0730552493776
510,Cultural believe mean hold.,3236520945393
511,Stock range at receive.,9341388507455
512,Sure born help onto write.,9037444772843
513,Record himself time own.,6477474491896
514,Mind raise cost.,2055307316277
515,Real exactly half sell.,7861135301850
516,Field history score fight.,3854128514546
517,Include view friend maintain.,3053161224034
518,Back common back enough.,3528771263235
519,Change national first boy.,5792081841096
520,Focus nature order boy.,8802173716885
521,Story where plant skin.,9313884825265
522,Including ask tree.,8129359704178
523,Garden use stand.,3783875983162
524,Maintain hair easy increase.,6211242944814
525,Teach figure no Mr.,9151409890103
526,Them piece if fact.,4442481216482
527,Political hope meet letter.,0308706202866
528,Dream a visit benefit.,2366783268067
529,View sound their dark.,7415023122432
530,Sit free put cup voice.,2660115370689
531,Blood worker entire.,9417252172699
532,Raise order somebody.,9758292917759
533,Trip politics including.,8636498509026
534,Present firm race least.,6520090932325
535,Not shoulder back least.,3909843958820
536,Least their purpose choose.,8047012629432
537,Bar general hope phone.,4938085364648
538,Certainly painting yeah.,7821626445098
539,Popular key we black.,3263965024826
540,Spring material guy agent.,4507901781596
541,Recently half well raise.,3185777799634
542,Appear thousand ago.,9925790432859
543,Ask fight into across happy.,5306514189817
544,Same whole yes speech.,0218041771685
545,Poor interest PM finally.,5331463538690
546,Identify article Congress.,8055826087386
547,Low run skill tell over.,0975304925185
548,Make check few step.,9302233101297
549,Book sort others.,4731037034855
550,Shake since this product.,6101748840836
551,Control change yeah.,7571128340598
552,Boy animal expect remain.,5291620095704
553,Large economic war.,5286337658700
554,Four usually computer.,1731177119279
555,Physical art focus paper.,4410355858038
556,Fly support scene describe.,6269288204577
557,Onto need such century.,0689430308865
558,No never firm service.,3132959068842
559,Point sit name travel.,1058046012654
560,Why page job key.,0013060198334
561,These toward whatever old.,1741084199028
562,Believe although mind walk.,3270096514195
563,Sometimes many itself drop.,2002769793221
564,Inside class data bring way.,0775985486971
565,Good find plan just you blue.,9135265436651
566,Growth of think ready.,8919599616320
567,Poor treatment contain.,4531782995124
568,Fight happy fine he.,8230372272909
569,Court old involve assume.,6881106008343
570,Approach board everybody.,0889290798916
571,Play message question.,0773648873656
572,Provide same laugh different.,0374964087644
573,Example or happen third.,1090830077081
574,Country stop rich rich buy.,2976240713537
575,Paper offer maintain nation.,8393624483000
576,Tell throw material.,4789958042220
577,Example direction crime with.,8142633840171
578,Parent science season.,6391130811951
579,Fast son strong.,6777243798455
580,Pay look language above.,2729876456008
581,Either method list north.,2885743270822
582,Send share according measure.,9000333192220
583,Toward whose whom drug.,5077135727022
584,Law win three tree.,2557689403953
585,Tonight box right main try.,2603229744892
586,Really job eat high.,5337220373474
587,Example buy again turn ago.,1950222087541
588,Lead back keep action.,3027145723134
589,Realize soldier blood around.,1784164428830
590,White table very measure.,8166669259622
591,Appear investment mean into.,1913060304492
592,Physical business body them.,5267438483705
593,School raise but audience.,0310123490603
594,Spend popular wait least.,3826591882873
595,Effort black up boy avoid.,0582701436710
596,Eye south his school word.,4920717854733
597,Through leave material end.,7355124775932
598,A also college smile.,4416510057957
599,Song finish rather.,0541755832626
600,How soon baby step.,1432009869200
601,Painting today rich lose.,3078152024165
602,Table apply time until level.,2900413367777
603,Fight avoid base report.,1017964420514
604,Often lay use myself.,3168158887793
605,Develop hot law officer.,8166623696272
606,Campaign region finally two.,7018592581701
607,Night role lead admit.,3986968791662
608,My know and.,8350202377458
609,Forget wrong site light.,4504368520249
610,Discuss establish under.,1865728600609
611,Cause letter light.,0905742886540
