Index,Name,EAN
612,Drive some many wear.,4866932067872
613,Believe per doctor.,6643706746618
614,Major likely hot mind wish.,8082148435410
615,Also expect blood clearly.,6726557905165
616,Change worry guess college.,3328135965917
617,Tax number sort set.,5140900190250
618,House rate else himself cost.,1569029920977
619,Probably care tough address.,9326991104895
620,She pass board arm sell.,4072189219357
621,Step thank yeah kitchen who.,6652993543916
622,View check employee ball set.,3258189122779
623,Big send foot.,9769662760615
624,Family raise answer citizen.,2880827692835
625,Deal arm clear job.,4443337020789
626,College amount person of.,1117132513250
627,Religious event add per.,0506197382047
628,Space those onto training.,3198851660508
629,Mention ball already degree.,7099031139004
630,Set much age matter there.,8877279915449
631,Economic camera nature.,8007423074832
632,How establish behavior safe.,1010981940607
633,Cup law value protect.,6672690454117
634,Chance happy law law glass.,0559609162416
635,Record sing seven good.,7340555562916
636,Growth letter by door edge.,4211765165767
637,Seem choice like interview.,5773205563391
638,West born major.,4187673716431
639,Another chair economy.,3942724246661
640,Wall foot company ok.,0754275547066
641,Coach call fact economic.,7809645359657
642,Nothing medical hour rock.,0671392973144
643,Market enter officer.,2814510781865
644,Part work assume.,7442415623307
645,Build civil learn skin.,8362184637628
646,Us middle traditional pick.,8412059733280
647,Lead road all good determine.,4389768132335
648,Institution could TV PM.,5040441532451
649,Song agent practice.,0468159294044
650,Week phone inside.,7694255427250
651,Raise compare this.,9688690521633
652,Physical rule dream.,4749487102086
653,Spend care or north write.,6035620559151
654,Least hand work notice best.,5797856535705
655,Than simple young create.,5656657611684
656,Food cause rather specific.,3770122737241
657,Should any store newspaper.,2367771818707
658,List food gun.,2167672295122
659,Generation hold people sea.,0923006521853
660,Mr somebody parent.,2860751881963
661,Color outside could.,1225771561249
662,Power wind next risk.,6788743128376
663,About officer memory here.,1593999332478
664,Instead head history.,9817907157765
665,Although worry all she.,3910711978833
666,Rise across teach statement.,0786734218217
667,Card half seem no shake.,9560030183896
668,Hotel former senior home.,2154736286295
669,Meeting staff scene language.,2432519280723
670,Worry many recent after.,7773247626083
671,Box oil little.,0245255967559
672,Stock subject team strong.,6267242410750
673,Ability approach think trial.,9124286935847
674,Call need respond.,3776009925169
675,Home family garden general.,5701788310453
676,Eight ask five.,2854000717332
677,Everyone day behind former.,2028070713765
678,Performance coach plant can.,2446652255586
679,Than big possible PM sit.,7002555545695
680,Quite artist health however.,2528440844902
681,Oil modern heavy matter.,2776714698779
682,Matter it exist law group.,1849529329334
683,Across notice work however.,8962119129497
684,Too hold worker.,3235645145640
685,Sell former field also.,2482206207502
686,Never front law.,8593950910069
687,Movie example good become.,5136301209950
688,Southern gun someone short.,1217561084953
689,Deep at election contain.,7847982707564
690,Fund discuss Mr middle.,1975100063790
691,Face ask model poor meet.,5468176586127
692,Particular gas later save.,2565969829232
693,Growth step our.,1508722029372
694,Foot then air.,3671234807160
695,Likely leave number through.,9088829039259
696,Write purpose line room fly.,8646475292230
697,Rich civil focus process.,5764453991586
698,Material present itself east.,1110176965269
699,American site against four.,6309791763533
700,He name down.,5093897269075
701,Law meeting attention.,0515291593228
702,Article TV none project.,2536067028681
703,Up unit down well network.,3288409067153
704,Fact will support throw.,6956114932079
705,This also him leave another.,6356200175791
706,Memory resource program who.,7706843914766
707,Charge evidence toward style.,7952950004832
708,Night wide near word.,2142471166477
709,Expert alone leave should.,5680516363377
710,Probably while media.,9346108191396
711,Many seem little step enter.,0926375138516
712,I possible ok receive.,1960095858124
713,Just agree news federal.,7388719672415
714,Return figure sit cost draw.,5155149484978
715,Major prove stuff her for.,9680996922213
716,Set three own street people.,4607362388829
717,Writer science establish.,3770181800900
718,Need protect city price live.,9665387555584
719,Maybe voice just local.,5736417513707
720,Risk choice public Congress.,1494806432704
721,Play accept look television.,8618684760138
722,Drop life community yes.,9292139214415
723,Here piece state.,0976882055929
724,Mr rest physical when.,9676351001020
725,Mother rate effect PM among.,3820770399763
726,Second rather treat week.,6641776327652
727,Eat thus language.,4774994730187
728,Above you seven where.,6182106925754
729,Lay do authority of.,3737692462492
730,Discussion this may many.,1449044594608
731,Sea time subject sea free.,0815323889931
732,Hospital commercial remember.,4471828672933
733,Tend talk head police.,2840068822194
734,Right television or leave.,9976555370923
735,Say best language.,2654757280970
736,Assume protect state plan.,2058763737372
737,Street artist lawyer develop.,1456101205766
738,Others ahead office before.,2504579914631
739,Eight recent phone.,9212402660282
740,National art test Mr.,1558794051016
741,Necessary customer billion.,8081698455169
742,Us democratic hair.,8083368816461
743,Material gun and break.,6190355900033
744,Produce he five gun.,0778082847256
745,Study firm fire around mind.,5714901649538
746,Person respond whole.,8875851649379
747,Less watch free bar watch.,4289105637267
748,Outside smile safe news.,4839550271693
749,Pick item art.,4572402161673
750,Ten want large ever author.,4481451245961
751,Reduce room Congress.,3958290360755
752,Media energy economy.,0676855951677
753,Instead increase week house.,7030994628822
754,Local arrive few research.,2196212462564
755,Star final effort fill coach.,2852553192569
756,Significant seven among ask.,0517009614010
757,Building hit tough for my.,5635792472206
758,Song exactly cost toward.,9031315543358
759,Career trade picture piece.,9495186795504
760,Strategy finally field along.,4510281614057
761,Moment white reach series.,6237461156531
762,Believe court audience.,6150300538810
763,Assume fly very.,7619430684044
764,There their teach we adult.,7250920062487
765,Couple data guy most drug.,9199972769778
766,Room easy time including.,6666938711391
767,He rest win focus.,0052667057002
768,Computer suffer player.,6883545521865
769,Lay sea coach establish news.,2832239327386
770,Better one film tell.,3741444556773
771,Gas heavy instead bar start.,3804706346090
772,Daughter source hard assume.,3358027540939
773,Cause there human have.,7277809755704
774,College report though.,2665054852906
775,Interesting here rather.,4195737379560
776,Player there drive low road.,0184070907350
777,Catch more base future.,2166395281207
778,Lose vote industry both.,9320455872856
779,Low dinner behavior.,9880649272669
780,Head leader yes parent many.,2374656597213
781,Me tax own must safe share.,1342388811892
782,Early let be statement.,4950346222993
783,Assume gun gun no us.,3067818010734
784,Ok find travel although.,8611371154357
785,Low discuss stop what admit.,4493111679818
786,Building realize girl.,1933096782316
787,Which measure season fact.,4543003407972
788,Worry you pick.,9215496167507
789,Effort I president Mrs.,4802740974216
790,Seven seven daughter.,7664266420328
791,Soon level ever maybe long.,5232958216720
792,Teacher trade country same.,6345236680133
793,Base a collection what.,3462797821188
794,This whether it city.,7878877902351
795,Compare four learn rule last.,2208924609714
796,Young from south ball.,6603646411953
797,Clear single nice shake.,5161369948572
798,Describe network no return.,7130486082061
799,Never cold deal dinner hold.,6593099910526
800,Among artist lay store.,4441764826882
801,Kind truth order official.,6928785164325
802,Suffer week miss form.,8525381229779
803,Send mother anything well.,8480217377843
804,Film at level song walk.,3587147663383
805,House state gun lay.,8841562524496
806,Recent learn management know.,2094870600215
807,Research think not teach.,3695538591341
808,Reason rock main.,6446126679203
809,Environmental treat act say.,7172814253637
810,Attention down the.,0002689122790
811,Analysis way anyone cold.,2440801606243
812,Report meet study sign thus.,6108877898646
813,Main only this church.,2451925002057
814,Threat decide alone ability.,8449573722223
815,Which shoulder beyond serve.,0111412012885
816,Floor radio every share.,4791169874880
817,Land your seek real several.,2801308058919
818,Million room forget region.,8897093527093
819,Senior ago stand fear.,2564962951490
820,Charge share large study.,6324322654708
821,Once enjoy too.,2700591365165
822,Two only animal.,3266903353798
823,Talk couple manage what.,8782891059108
824,Safe song will.,7519079965422
825,Learn piece Mr suddenly.,5431087171973
826,Hear surface letter speak.,2918900777978
827,Experience Republican water.,3434328796814
828,Forget subject lose picture.,1816834764518
829,Pm fire affect.,2287562355818
830,In discover white may large.,2751827524023
831,Science group century how.,7204271862227
832,Lawyer although night whom.,5353473228576
833,Develop rise morning contain.,1101257643800
834,Road left manage design we.,7064576822308
835,Produce hair hold scene.,0893768569908
836,Situation nothing pull name.,6580497806834
837,Explain gas seek real.,1959343400208
838,Exactly us big bank recently.,0327915214088
839,Whole computer action again.,9635785617016
840,Security money especially.,5136187310931
841,Fact daughter record.,8522000697506
842,Window government probably.,7528639125060
843,Fish commercial process.,8533491226717
844,Art can my ask no.,8704802411942
845,Analysis surface eye perhaps.,5791295173016
846,Seven carry effect skill.,8193445171854
847,Size financial able out have.,7574663888198
848,Develop camera number worry.,5919911066447
849,Half I job.,1693845510071
850,Measure politics turn red.,2470469433622
851,Hard issue goal indicate.,8407784574710
852,Clearly not develop those.,6677040928546
853,Left heart color president.,1002766182463
854,We fall off production.,4916138065230
855,Face church data sure order.,5584799357309
856,And another do.,2351706705354
857,Crime his easy attack test.,5829685835838
858,We each only.,5134547515903
859,According act contain stage.,1277337100874
860,Song but long early these.,6498330103111
861,Rate market rule fear since.,3815454506216
862,Example network major.,0740056658038
863,Fast society picture.,2988637337004
864,Local expect number current.,0418134598285
865,Congress drive audience.,1090158551607
866,You fill fall.,1050291343156
867,Simply account better.,5476390862057
868,Themselves let author.,3858876408324
869,Story control piece debate.,1468376462812
870,Value situation see.,6960804116120
871,Son necessary space trial.,2270018516420
872,Case adult force door.,1567431439469
873,Pattern back almost defense.,3586630772434
874,Street name plant challenge.,5657582730839
875,Improve also figure fast.,1356137967983
876,Product her worry bit.,5034436019447
877,Choose sport send half.,9393880167460
878,Art avoid current ten.,1442913492999
879,Even modern that.,1998411424135
880,Deep here always local yeah.,3874593827972
881,Represent forget site figure.,3213012280132
882,Hold poor too year.,4012646823970
883,With step girl television.,9517055844608
884,Thought benefit apply.,0530220951153
885,Tell color he public family.,0087235006991
886,Image both measure air.,7751685397314
887,Assume necessary economy.,8167430623703
888,Home team industry mother.,4706280896420
889,Second crime game state.,0170535016040
890,Factor place student effect.,3618107481553
891,Mr you later we.,6447797985136
892,Notice special car however.,8895251594185
893,May success hotel foot.,9796413628597
894,Kid might mind writer.,2758046750363
895,Newspaper stand public two.,0871861176155
896,Value view hospital recently.,5675255316029
897,Bag operation field chair.,2837066102908
898,Feeling spend career anyone.,2618322271961
899,Religious they instead boy.,0252745848410
900,Glass base decade force.,2872426939138
901,Address quickly various.,9747705328381
902,People window rate eight.,6443446061060
903,Present expect between.,9886889162104
904,Color general he.,3431577136958
905,Study enough any.,9107043727879
906,Tell eye say score huge.,5161699552500
907,Bed any kid.,5967356718292
908,Nice career book within.,8137814949354
909,Natural my everyone decision.,8771416503707
910,Wait sister age page room.,7301349303405
911,Near yes material.,8666553839645
912,Field soldier yes firm.,4887507770287
913,Move in buy know chance.,1133466122838
914,Country likely senior.,4653211556802
915,Voice full field.,1182984373468
916,Soldier huge partner.,4495750383125
917,Or kind forward between.,6799016629568
918,Young it bed.,2784871079102
919,Have anyone hand article.,3002842841060
920,Test energy force move.,2819976230575
921,Director must major computer.,1561521211515
922,Evidence beyond crime feel.,8594434507065
923,Health dinner address serve.,9265977670958
924,Soon walk already medical.,7214233019859
925,Full billion society or.,7145039403200
926,Do offer always.,2524029571030
927,Ability year choice box.,2969281046139
928,Determine see get idea best.,8590995100035
929,Tell may expect never senior.,4361942083862
930,Pm move measure democratic.,8022864733520
931,Rate enter trade civil.,4773885271457
932,Them strategy country.,6802135679175
933,Of sometimes here medical.,0824200604215
934,New shoulder often fire.,2351217823950
935,Other fill idea best sing.,0063809933566
936,The fear fly Congress.,3395144956175
937,President recent democratic.,6099033091783
938,Fear fall production of.,4655290318494
939,Exactly treat model they.,5204484528943
940,Hand stand write.,5836520514728
941,Economy main give night.,9113903150992
942,Expect four when meet.,4939645824985
943,Foot field kind.,1816410618228
944,Ever heart science federal.,3444909648791
945,Rule record blood now in.,4690544548531
946,Affect strategy leg compare.,8405334237818
947,Rock candidate blood.,2198698020436
948,Pressure pull capital.,8928033355213
949,Industry rest how.,9584614118456
950,Where more alone result.,2127946030774
951,Various occur language.,2619977471393
952,College free form check word.,1631925606009
953,One best clear camera action.,3731989116938
954,Hit everybody area it size.,2749210115897
955,All him leader might.,1405124055353
956,Cultural office them mission.,6414334336218
957,Number fish side.,6174992402099
958,Now official somebody.,3243361498490
959,Citizen rule born message.,5234422555618
960,Attorney south many reduce.,1681301089667
961,Wife rest school room.,0768898436522
962,Will their stuff go draw.,6484374085391
963,Base billion left allow.,5925466270048
964,Believe increase inside rise.,7078005484739
965,Technology local skin glass.,6856002951369
966,Security leave Mrs.,5514166292070
967,Ask bag rock give church.,0373285179397
968,Find style leave.,1054124212688
969,Station card first activity.,4940322293512
970,Wife decision real.,0458649021267
971,True lose lawyer positive.,1116253544020
972,Blood provide enough.,0597058432230
973,List she should.,7598868006355
974,Service live by.,7520559751336
975,Yourself ask subject.,4526008071744
976,Run record child establish.,7389688634411
977,Every stock sort look.,8428512770624
978,Real marriage free what.,0877152574761
979,Food hotel worker.,3241839302522
980,Figure nature from unit.,9991169887353
981,Read mind too number.,2223406239814
982,Thus without son through.,1649448772064
983,Benefit image unit business.,0306799411721
984,Consider adult truth method.,7017409699028
985,Truth third certainly visit.,5598824528619
986,Real nature to make.,6354192616803
987,Task I world road.,0155909127621
988,I result home represent.,6517585368219
989,Few build important budget.,1971866676588
990,Daughter green age put.,3862836704777
991,Indeed look perform their.,9667316821159
992,Could cold show receive.,6520693594739
993,Great goal many back note.,5150043202253
994,Pass energy stop mind north.,7376418278748
995,Oil law race.,0809675545171
996,Person health next agency.,7320434860708
997,Century produce store avoid.,5168253423375
998,Agency why father eight.,8777144247869
999,Stop knowledge according.,7021605133286
1000,More ahead together.,7139364656189
